hanzi,pinyin,english
毫米,hao2 mi3,"millimeter,"
方位,fang1 wei4,"direction, points of the compass, bearing, position, azimuth,"
分辨,fen1 bian4,"to distinguish, to differentiate, to resolve,"
片刻,pian4 ke4,"short period of time, a moment,"
往事,wang3 shi4,"past events, former happenings,"
油漆,you2 qi1,"oil paints, lacquer, to paint, CL:層|层[céng],"
恩怨,en1 yuan4,"(feeling of) resentment, (longstanding) grudge,"
功勞,gong1 lao2,"contribution, meritorious service, credit,"
濺,jian4,"splash,"
難得,nan2 de2,"seldom, rare, hard to come by,"
安置,an1 zhi4,"to find a place for, to help settle down, to arrange for, to get into bed, placement,"
信賴,xin4 lai4,"to trust, to have confidence in, to have faith in, to rely on,"
行政,xing2 zheng4,"administrative, executive (adjective),"
原告,yuan2 gao4,"complainant, plaintiff,"
跌,die1,"to drop, to fall, to tumble, Taiwan pr. [dié],"
機關,ji1 guan1,"mechanism, gear, machine-operated, office, agency, organ, organization, establishment, institution, body, strategum, scheme, intrigue, plot, trick, CL:個|个[gè],"
嫌,xian2,"to dislike, suspicion, resentment, enmity, abbr. for 嫌犯, criminal suspect,"
戰役,zhan4 yi4,"military campaign,"
償還,chang2 huan2,"to repay, to reimburse,"
毆打,ou1 da3,"to beat up, to come to blows, battery (law),"
權威,quan2 wei1,"authority, authoritative, power and prestige,"
作風,zuo4 feng1,"style, style of work, way,"
罷工,ba4 gong1,"a strike, to go on strike,"
智商,zhi4 shang1,"IQ (intelligence quotient),"
兜,dou1,"pocket, bag, to wrap up or hold in a bag, to move in a circle, to canvas or solicit, to take responsibility for, to disclose in detail, combat armor (old),"
邁,mai4,"take a step,"
便利,bian4 li4,"convenient, easy, to facilitate,"
強制,qiang2 zhi4,"to enforce, enforcement, forcibly, compulsory,"
免疫,mian3 yi4,"immunity (to disease),"
烹飪,peng1 ren4,"cooking, culinary arts,"
特色,te4 se4,"characteristic, distinguishing feature or quality,"
澄清,cheng2 qing1,"clear (of liquid), limpid, to clarify, to make sth clear, to be clear (about the facts),"
擴散,kuo4 san4,"to spread, to proliferate, to diffuse, spread, proliferation, diffusion,"
過失,guo4 shi1,"defect, fault,"
竭盡全力,jie2 jin4 quan2 li4,"to spare no effort (idiom); to do one's utmost,"
眼下,yan3 xia4,"now, at present, subocular (medicine),"
依據,yi1 ju4,"according to, basis, foundation,"
預期,yu4 qi1,"to expect, to anticipate,"
擰,ning2,"to pinch, wring,"
圖案,tu2 an4,"design, pattern,"
規劃,gui1 hua4,"to plan (how to do sth), planning, plan, program,"
後代,hou4 dai4,"posterity, later periods, later ages, later generations,"
卡通,ka3 tong1,"cartoon,"
孔,Kong3,"hole, CL:個|个[gè], classifier for cave dwellings,"
拿手,na2 shou3,"expert in, good at,"
航行,hang2 xing2,"to sail, to fly, to navigate,"
色彩,se4 cai3,"tint, coloring, coloration, character,"
支撐,zhi1 cheng1,"to prop up, to support, strut, brace,"
淋,lin2,"to drain, to drench, to drip, diseases of the bladder,"
伴隨,ban4 sui2,"to accompany, to follow, to occur together with, concomitant,"
同胞,tong2 bao1,"born of the same parents, sibling, fellow citizen, compatriot,"
佔有,zhan4 you3,"to have, to own, to hold, to possess,"
沼澤,zhao3 ze2,"marsh, swamp, wetlands, glade,"
案例,an4 li4,"case (law), CL:個|个[gè],"
導航,dao3 hang2,"navigation,"
惱火,nao3 huo3,"to get angry, irritated, to annoy, to aggravate, annoying,"
體面,ti3 mian4,"dignity, face (as in ""losing face""), honorable, creditable, pretty,"
折騰,zhe1 teng5,"to toss from side to side (e.g. sleeplessly), to repeat sth over and over again, to torment sb, to play crazy,"
珍珠,zhen1 zhu1,"pearl, CL:顆|颗[kē],"
臨床,lin2 chuang2,"clinical,"
探望,tan4 wang4,"to visit,"
外界,wai4 jie4,"the outside world, external,"
頗,Po1,"rather, quite, considerably (Taiwan pr. ), oblique, inclined, slanting,"
事態,shi4 tai4,"situation, existing state of affairs,"
準則,zhun3 ze2,"norm, standard, criterion,"
初步,chu1 bu4,"initial, preliminary, tentative,"
覆蓋,fu4 gai4,"to cover,"
示範,shi4 fan4,"to demonstrate, to show how to do sth, demonstration, a model example,"
先前,xian1 qian2,"before, previously,"
邊界,bian1 jie4,"boundary, border,"
挑剔,tiao1 ti5,"picky, fussy,"
飛翔,fei1 xiang2,"to fly,"
無賴,wu2 lai4,"hoodlum, rascal, rogue, rascally, scoundrelly,"
以免,yi3 mian3,"in order to avoid, so as not to,"
搭配,da1 pei4,"to pair up, to match, to arrange in pairs, to add sth into a group,"
擾亂,rao3 luan4,"to disturb, to perturb, to harass,"
統統,tong3 tong3,"totally,"
報到,bao4 dao4,"to report for duty, to check in, to register,"
報社,bao4 she4,"general office of a newspaper, newspaper office, CL:家[jiā],"
熱門,re4 men2,"popular, hot, in vogue,"
審查,shen3 cha2,"to examine, to investigate, to censor out, censorship,"
飲食,yin3 shi2,"food and drink, diet,"
測量,ce4 liang2,"survey, to measure, to gauge, to determine,"
譴責,qian3 ze2,"to denounce, to condemn, to criticize, condemnation, criticism,"
推翻,tui1 fan1,"to overthrow,"
威力,wei1 li4,"might, formidable power,"
虛偽,xu1 wei3,"false, hypocritical, artificial, sham,"
吹牛,chui1 niu2,"to talk big, to shoot off one's mouth, to chat (dialect),"
互聯網,Hu4 lian2 wang3,"the Internet,"
敬禮,jing4 li3,"to salute, salute,"
吸取,xi1 qu3,"to absorb, to draw (a lesson, insight etc), to assimilate,"
辨認,bian4 ren4,"to recognize, to identify,"
成天,cheng2 tian1,"(coll.) all day long, all the time,"
激發,ji1 fa1,"to arouse, to excite,"
發財,fa1 cai2,"to get rich,"
獎賞,jiang3 shang3,"reward, prize, award,"
壓迫,ya1 po4,"to oppress, to repress, to constrict, oppression, stress (physics),"
姿態,zi1 tai4,"attitude, posture, stance,"
界限,jie4 xian4,"boundary, marginal,"
金融,jin1 rong2,"banking, finance, financial,"
品嘗,pin3 chang2,"to taste a small amount, to sample,"
丸,wan2,"pill,"
雕塑,diao1 su4,"a statue, a Buddhist image, sculpture, to carve,"
可行,ke3 xing2,"feasible,"
種子,zhong3 zi5,"seed, CL:顆|颗,粒[lì],"
充足,chong1 zu2,"adequate, sufficient, abundant,"
共和國,gong4 he2 guo2,"republic,"
人工,ren2 gong1,"artificial, manpower, manual work,"
手勢,shou3 shi4,"gesture, sign, signal,"
抑制,yi4 zhi4,"to inhibit, to keep down, to suppress,"
隱蔽,yin3 bi4,"to conceal, to hide, covert, under cover,"
產業,chan3 ye4,"industry, estate, property, industrial,"
公關,gong1 guan1,"public relations,"
口氣,kou3 qi4,"tone of voice, the way one speaks, manner of expression, tone,"
群眾,qun2 zhong4,"mass, multitude, the masses,"
散發,san4 fa1,"to distribute, to emit, to issue,"
水泥,shui3 ni2,"cement, CL:袋[dài],"
採集,cai3 ji2,"to gather, to collect, to harvest,"
品質,pin3 zhi4,"quality,"
任命,ren4 ming4,"to appoint and nominate, (job) appointment, CL:紙|纸[zhǐ],"
旋律,xuan2 lu:4,"melody, rhythm,"
爭議,zheng1 yi4,"controversy, dispute, to dispute,"
琢磨,zhuo2 mo2,"to carve and polish (jade), to polish and refine a literary work,"
等級,deng3 ji2,"grade, rank, status,"
顛倒,dian1 dao3,"to turn upside-down, to reverse, back-to-front, confused, deranged, crazy,"
俘虜,fu2 lu3,"captive,"
宮殿,gong1 dian4,"palace, CL:座[zuò],"
算數,suan4 shu4,"to count numbers, to keep to one's word, to hold (i.e. to remain valid), to count (i.e. to be important),"
現狀,xian4 zhuang4,"current situation,"
都市,du1 shi4,"city, metropolis,"
喇叭,la3 ba5,"horn (automobile etc), loudspeaker, brass wind instrument, trumpet, suona 鎖吶|锁呐[suǒ nà],"
莫名其妙,mo4 ming2 qi2 miao4,"unfathomable mystery (idiom); subtle and ineffable, unable to make head or tail of it, boring (e.g. movie),"
旗幟,qi2 zhi4,"ensign, flag,"
分歧,fen1 qi2,"difference (of opinion, position), bifurcation,"
期限,qi1 xian4,"time limit, deadline, allotted time,"
探測,tan4 ce4,"to probe, to take readings, to explore, exploration,"
智力,zhi4 li4,"intelligence, intellect,"
當選,dang1 xuan3,"to be elected,"
用戶,yong4 hu4,"user, consumer, subscriber, customer,"
反常,fan3 chang2,"unusual, abnormal,"
書面,shu1 mian4,"in writing, written,"
原先,yuan2 xian1,"former, original,"
遙控,yao2 kong4,"remote control,"
顫抖,chan4 dou3,"to shudder, to shiver, to shake, to tremble,"
反感,fan3 gan3,"to be disgusted with, to dislike, bad reaction, antipathy,"
光彩,guang1 cai3,"luster, splendor, radiance, brilliance,"
空虛,kong1 xu1,"hollow, emptiness, meaningless,"
照料,zhao4 liao4,"to tend, to take care of sb,"
蒼白,cang1 bai2,"pale, wan,"
否決,fou3 jue2,"veto,"
兼職,jian1 zhi2,"to hold concurrent posts, concurrent job, moonlighting,"
交代,jiao1 dai4,"to hand over, to explain, to make clear, to brief (sb), to account for, to justify oneself, to confess, to finish (colloquial),"
忙碌,mang2 lu4,"busy, bustling,"
排斥,pai2 chi4,"to reject, to exclude, to eliminate, to remove, to repel,"
蹤跡,zong1 ji4,"tracks, trail, footprint, trace, vestige,"
設想,she4 xiang3,"to imagine, to assume, to envisage, tentative plan, to have consideration for,"
煙花,yan1 hua1,"fireworks, prostitute (esp. in Yuan theater),"
終究,zhong1 jiu1,"in the end, after all is said and done,"
內在,nei4 zai4,"intrinsic, innate,"
視力,shi4 li4,"vision, eyesight,"
延續,yan2 xu4,"to continue, to go on, to last,"
忍耐,ren3 nai4,"to show restraint, to repress (anger etc), to exercise patience,"
樣品,yang4 pin3,"sample, specimen,"
啃,ken3,"to gnaw, to nibble, to bite,"
歲月,sui4 yue4,"years, passing of time,"
哎喲,ai1 yo1,"hey, ow, ouch, interjection of pain or surprise,"
滅亡,mie4 wang2,"to be destroyed, to become extinct, to perish, to die out, to destroy, to exterminate,"
約束,yue1 shu4,"to restrict, to limit to, to constrain, restriction, constraint,"
專長,zhuan1 chang2,"specialty, special knowledge or ability,"
辯解,bian4 jie3,"to explain, to justify, to defend (a point of view etc), to provide an explanation, to try to defend oneself,"
部署,bu4 shu3,"to dispose, to deploy, deployment,"
合成,he2 cheng2,"to compose, to constitute, compound, synthesis, mixture, synthetic,"
合身,he2 shen1,"well-fitting (of clothes),"
值班,zhi2 ban1,"to work a shift, on duty,"
補救,bu3 jiu4,"to remedy,"
記載,ji4 zai3,"to write down, to record, written account,"
揭發,jie1 fa1,"to expose, to bring to light, to disclose, revelation,"
體系,ti3 xi4,"system, setup, CL:個|个[gè],"
供給,gong1 ji3,"to furnish, to provide, supply (as in supply and demand),"
教養,jiao4 yang3,"to train, to educate, to bring up, to nurture, education, culture, upbringing, early conditioning,"
緊密,jin3 mi4,"inseparably close,"
埋伏,mai2 fu2,"to ambush, to lie in wait for, to lie low, ambush,"
疲憊,pi2 bei4,"beaten, exhausted, tired,"
生效,sheng1 xiao4,"to take effect, to go into effect,"
溫和,wen1 he2,"mild, gentle, moderate,"
標題,biao1 ti2,"title, heading, headline, caption, subject,"
搏鬥,bo2 dou4,"to wrestle, to fight, to struggle,"
不顧,bu4 gu4,"in spite of, regardless of,"
疑惑,yi2 huo4,"to doubt, to distrust, unconvincing, to puzzle over, misgivings, suspicions,"
火藥,huo3 yao4,"gunpowder,"
耀眼,yao4 yan3,"to dazzle, dazzling,"
昆蟲,kun1 chong2,"insect, CL:隻|只,群,堆[duī],"
拾,she4,"to pick up, to collate or arrange, ten (banker's anti-fraud numeral),"
鼻涕,bi2 ti4,"nasal mucus, snivel,"
燦爛,can4 lan4,"to glitter, brilliant, splendid,"
出身,chu1 shen1,"to be born of, to come from, family background, class origin,"
迷信,mi2 xin4,"superstition, to have a superstitious belief (in sth),"
清晨,qing1 chen2,"early morning,"
瞪,deng4,"to open (one's eyes) wide, to stare at, to glare at,"
季度,ji4 du4,"quarter of a year, season (sports),"
任意,ren4 yi4,"arbitrary, at will, at random,"
野心,ye3 xin1,"ambition, wild schemes, careerism,"
理所當然,li3 suo3 dang1 ran2,"as it should be by rights (idiom); proper and to be expected as a matter of course, inevitable and right,"
殘留,can2 liu2,"to remain, left over, surplus, remnant,"
粉碎,fen3 sui4,"to crush, to smash, to shatter,"
視野,shi4 ye3,"field of view, horizon,"
挑釁,tiao3 xin4,"to provoke, provocation,"
職務,zhi2 wu4,"post, position, job, duties,"
動身,dong4 shen1,"to go on a journey, to leave,"
公道,gong1 dao4,"fair, equitable,"
擅自,shan4 zi4,"without permission, of one's own initiative,"
扒,ba1,"to hold on to, to cling to, to dig up, to rake, to push aside, to climb, to pull out, to strip off,"
廢墟,fei4 xu1,"ruins,"
輝煌,hui1 huang2,"splendid, glorious,"
蔓延,man4 yan2,"to extend, to spread,"
敏銳,min3 rui4,"keen, sharp, acute,"
翼,Yi4,"wing, area surrounding the bullseye of a target, to assist, one of the 28 constellations of Chinese astronomy, old variant of 翌,"
密封,mi4 feng1,"to seal up,"
轟動,hong1 dong4,"to cause a sensation,"
審理,shen3 li3,"to hear (a case),"
夏令營,xia4 ling4 ying2,"summer camp,"
消極,xiao1 ji2,"negative, passive, inactive,"
眨,zha3,"to blink, to wink,"
北極,bei3 ji2,"the North Pole, the Arctic Pole, the north magnetic pole,"
設立,she4 li4,"to set up, to establish,"
勿,wu4,"do not,"
弦,xian2,"bow string, string of musical instrument, watchspring, chord (segment of curve), hypotenuse, CL:根[gēn],"
延期,yan2 qi1,"to delay, to extend, to postpone, to defer,"
登錄,deng1 lu4,"to register, to log in,"
淘氣,tao2 qi4,"naughty, bad,"
蒸發,zheng1 fa1,"to evaporate, evaporation,"
沖擊,chong1 ji1,"an attack, under attack, a shock,"
看望,kan4 wang4,"to visit, to pay a call to,"
盲目,mang2 mu4,"blind, blindly, ignorant, lacking understanding,"
竪,shu4,"to erect, vertical, vertical stroke (in Chinese characters),"
頻繁,pin2 fan2,"frequently, often,"
畏懼,wei4 ju4,"to fear, to dread, foreboding,"
支配,zhi1 pei4,"to control, to dominate, to allocate,"
時常,shi2 chang2,"often, frequently,"
證書,zheng4 shu1,"credentials, certificate,"
壯觀,zhuang4 guan1,"spectacular, magnificent sight,"
成本,cheng2 ben3,"(manufacturing, production etc) costs,"
歸還,gui1 huan2,"to return sth, to revert,"
思念,si1 nian4,"to think of, to long for, to miss,"
住宅,zhu4 zhai2,"residence, tenement,"
捧,peng3,"to clasp, to cup the hands, to hold up with both hands, to offer (esp. in cupped hands), to praise, to flatter,"
條約,tiao2 yue1,"treaty, pact, CL:個|个[gè],"
欣慰,xin1 wei4,"to be gratified,"
一貫,yi1 guan4,"consistent, constant, from start to finish, all along, persistent,"
豐滿,Feng1 man3,"ample, well developed, fully rounded,"
股份,gu3 fen4,"a share (in a company), stock,"
更新,geng1 xin1,"to replace the old with new, to renew, to renovate, to upgrade, to update, to regenerate,"
拐杖,guai3 zhang4,"crutches, crutch, walking stick,"
授予,shou4 yu3,"to award, to confer,"
推理,tui1 li3,"reasoning, speculative, inference,"
儲存,chu3 cun2,"stockpile, to store, to stockpile, storage,"
蛋白質,dan4 bai2 zhi4,"protein,"
龐大,pang2 da4,"huge, enormous, tremendous,"
輕而易舉,qing1 er2 yi4 ju3,"easy, with no difficulty,"
驗證,yan4 zheng4,"to inspect and verify, experimental verification, to validate (a theory), to authenticate,"
包袱,bao1 fu5,"cloth-wrapper, a bundle wrapped in cloth, load, weight, burden,"
不擇手段,bu4 ze2 shou3 duan4,"by fair means or foul, by hook or by crook, unscrupulously,"
側面,ce4 mian4,"lateral side, side, aspect, profile,"
潮流,chao2 liu2,"tide, current, trend,"
扛,gang1,"to carry on one's shoulder,"
徘徊,pai2 huai2,"to dither, to hesitate, to pace back and forth, by ext. to hover around, to linger,"
坡,po1,"slope, CL:個|个[gè], sloping, slanted,"
備忘錄,bei4 wang4 lu4,"memorandum, aide-memoire, memorandum book,"
臂,bi4,"arm,"
層次,ceng2 ci4,"arrangement of ideas, administrative level, level, stage, phase,"
捍衛,han4 wei4,"to defend, to uphold, to safeguard,"
摩擦,mo2 ca1,"friction, rubbing, chafing, fig. disharmony, conflict, same as 磨擦,"
泡沫,pao4 mo4,"foam, (soap) bubble, (economic) bubble,"
輔助,fu3 zhu4,"to assist, to aid, supplementary, auxiliary, subsidiary,"
戒備,jie4 bei4,"to take precautions, to guard against (emergency),"
劈,pi1,"to hack, to chop, to split open, (of lightning) to strike,"
無可奉告,wu2 ke3 feng4 gao4,"(idiom) ""no comment"","
嚴密,yan2 mi4,"strict, tight (organization, surveillance etc),"
預先,yu4 xian1,"beforehand, in advance,"
原理,yuan2 li3,"principle, theory,"
創新,chuang4 xin1,"innovation, to bring forth new ideas, to blaze new trails,"
將近,jiang1 jin4,"almost, nearly, close to,"
渠道,qu2 dao4,"irrigation ditch, medium or channel of communication,"
甦醒,su1 xing3,"to wake up, to regain consciousness,"
奔馳,Ben1 chi2,"to run quickly, to speed, to gallop,"
當前,dang1 qian2,"current, today's, modern, present, to be facing (us),"
塑造,su4 zao4,"to model, to mould, plastic (arts), flexible, to portray (in sculpture or in words),"
快活,kuai4 huo5,"happy, cheerful,"
況且,kuang4 qie3,"moreover, besides, in addition, furthermore,"
收益,shou1 yi4,"earnings, profit,"
消毒,xiao1 du2,"to disinfect, to sterilize,"
捕捉,bu3 zhuo1,"to catch, to seize, to capture,"
偏偏,pian1 pian1,"(indicates that sth turns out just the opposite of what one would expect or what would be normal), unfortunately, against expectations,"
瀑布,pu4 bu4,"waterfall,"
散佈,san4 bu4,"to disseminate,"
討價還價,tao3 jia4 huan2 jia4,"to haggle over price,"
笨拙,ben4 zhuo1,"clumsy, awkward, stupid,"
得罪,de2 zui4,"to commit an offense, to violate the law, excuse me! (formal), see also 得罪[dé zui],"
鋒利,feng1 li4,"sharp (e.g. knife blade), incisive, to the point,"
救濟,jiu4 ji4,"emergency relief, to help the needy with cash or goods,"
麻痺,ma2 bi4,"paralysis, palsy, numbness, to benumb,"
高明,Gao1 ming2,"brilliant, superior, tall and bright,"
機遇,ji1 yu4,"opportunity, favorable circumstance, stroke of luck,"
隆重,long2 zhong4,"grand, prosperous, ceremonious, solemn,"
讓步,rang4 bu4,"to concede, to give in, to yield, a concession,"
枝,zhi1,"branch, classifier for sticks, rods, pencils etc,"
彆扭,bie4 niu5,"awkward, difficult, uncomfortable, not agreeing, at loggerheads, gauche, awkward (writing or speech),"
誹謗,fei3 bang4,"to slander, to libel,"
洪水,hong2 shui3,"deluge, flood,"
扭轉,niu3 zhuan3,"to reverse, to turn around (an undesirable situation),"
聲譽,sheng1 yu4,"reputation, fame,"
意料,yi4 liao4,"to anticipate, to expect,"
專利,zhuan1 li4,"patent,"
揀,jian3,"to choose, to pick, to sort out, to pick up,"
區分,qu1 fen1,"to differentiate, to find differing aspects,"
喜悅,xi3 yue4,"happy, joyous,"
愈,yu4,"to heal,"
機靈,ji1 ling5,"clever, quick-witted,"
精緻,jing1 zhi4,"delicate, fine, exquisite, refined,"
音響,yin1 xiang3,"speakers or speaker (electronic), acoustics, sound field (in a room or theater),"
把手,ba3 shou3,"handle, grip, knob,"
開支,kai1 zhi1,"expenditures, pay, expenses, CL:筆|笔[bǐ],"
搶救,qiang3 jiu4,"rescue,"
親身,qin1 shen1,"personal, oneself,"
發育,fa1 yu4,"to develop, growth, development,"
股東,gu3 dong1,"shareholder, stockholder,"
迄今為止,qi4 jin1 wei2 zhi3,"so far, up to now, still (not),"
生育,sheng1 yu4,"to bear, to give birth, to grow, to rear, to bring up (children),"
消耗,xiao1 hao4,"to use up, to consume,"
歹徒,dai3 tu2,"evil-doer, malefactor, gangster, hoodlum,"
分解,fen1 jie3,"to resolve, to decompose, to break down,"
風度,feng1 du4,"elegance (for men), elegant demeanor, grace, poise,"
辜負,gu1 fu4,"to fail to live up (to expectations), unworthy (of trust), to let down, to betray (hopes), to disappoint,"
疲倦,pi2 juan4,"to tire, tired,"
一如既往,yi1 ru2 ji4 wang3,"just as in the past (idiom); as before, continuing as always,"
反駁,fan3 bo2,"to retort, to refute,"
反射,fan3 she4,"to reflect, reflection (from a mirror etc), reflex (i.e. automatic reaction of organism),"
故鄉,gu4 xiang1,"home, homeland, native place, CL:個|个[gè],"
內幕,nei4 mu4,"inside story, non-public information, behind the scenes, internal,"
貧困,pin2 kun4,"impoverished, poverty,"
司令,si1 ling4,"commanding officer,"
印刷,yin4 shua1,"print,"
政權,zheng4 quan2,"regime, (wield) political power,"
錘,chui2,"hammer, to hammer into shape, weight (e.g. of a steelyard or balance),"
竄,cuan4,"to flee, to scuttle, to exile or banish, to amend or edit,"
干預,gan1 yu4,"to meddle, to intervene, intervention,"
描繪,miao2 hui4,"to describe, to portray,"
平行,ping2 xing2,"parallel, of equal rank, simultaneous,"
迫害,po4 hai4,"to persecute, persecution,"
缺席,que1 xi2,"absence, absent,"
粥,yu4,"congee, gruel, porridge, CL:碗[wǎn],"
諸位,zhu1 wei4,"(pron) everyone, Ladies and Gentlemen, Sirs,"
池塘,chi2 tang2,"pool, pond,"
慣例,guan4 li4,"convention, usual practice,"
鞠躬,ju1 gong1,"to bow,"
摟,lou1,"to hug, to embrace, to hold in one's arms,"
融洽,rong2 qia4,"harmonious, friendly relations, on good terms with one another,"
照樣,zhao4 yang4,"as before, (same) as usual,"
凍結,dong4 jie2,"to freeze (loan, wage, price etc),"
較量,jiao4 liang4,"to have a contest with sb, to cross swords, to measure up against, to compete with, to haggle, to quibble,"
揉,rou2,"to knead, to massage, to rub,"
三角,san1 jiao3,"triangle,"
熄滅,xi1 mie4,"to stop burning, to go out (of fire), to die out, extinguished,"
嚮導,xiang4 dao3,"guide,"
做主,zuo4 zhu3,"make the decision, take charge of, back up, support, be host,"
裁縫,cai2 feng2,"tailor, dressmaker,"
放射,fang4 she4,"to radiate, radioactive,"
公務,gong1 wu4,"official business,"
光輝,guang1 hui1,"radiance, glory, brilliant, magnificent,"
合伙,he2 huo3,"to act jointly, to form a partnership,"
考察,kao3 cha2,"to inspect, to observe and study, on-the-spot investigation,"
素食,su4 shi2,"vegetables, vegetarian food,"
淹沒,yan1 mo4,"to submerge, to drown, to flood, to drown out (also fig.),"
觸犯,chu4 fan4,"to offend,"
伺候,ci4 hou4,"to serve, to wait upon,"
打官司,da3 guan1 si5,"to file a lawsuit, to sue, to dispute,"
風光,feng1 guang1,"scene, view, sight, landscape, to be well-regarded, to be well-off, grand (topolect), impressive (topolect),"
屑,xie4,"bits, fragments, crumbs, filings, trifling, trivial, to condescend to,"
要點,yao4 dian3,"main point, essential,"
不妨,bu4 fang2,"there is no harm in, might as well,"
斷絕,duan4 jue2,"to sever, to break off,"
構思,gou4 si1,"to design, to plot, to plan out, to compose, to draw a mental sketch, conception, plan, idea, composition,"
款待,kuan3 dai4,"to entertain, to be hospitable to,"
模範,mo2 fan4,"model, fine example,"
捎,shao1,"to bring sth to sb, to deliver,"
孤立,gu1 li4,"isolate, isolated,"
呻吟,shen1 yin2,"to moan, to groan,"
心血,xin1 xue4,"heart's blood, expenditure (for some project), meticulous care,"
注重,zhu4 zhong4,"to pay attention to, to emphasize,"
不堪,bu4 kan1,"cannot bear, cannot stand, utterly, extremely,"
掠奪,lu:e4 duo2,"to plunder, to rob, also written 略奪|略夺,"
勝負,sheng4 fu4,"victory or defeat, the outcome of a battle,"
讚揚,zan4 yang2,"to praise, to approve of, to show approval,"
遵循,zun1 xun2,"to follow, to abide by, to comply with, compliance,"
喘氣,chuan3 qi4,"to breathe deeply, to pant,"
精通,jing1 tong1,"proficient,"
刊登,kan1 deng1,"to carry a story, to publish (in a newspaper or magazine),"
麻木,ma2 mu4,"numb, insensitive, apathetic,"
氣象,qi4 xiang4,"meteorological feature, CL:個|个[gè], meteorology, atmosphere, ambience, scene,"
奢侈,she1 chi3,"luxurious, extravagant, wasteful,"
延伸,yan2 shen1,"to extend, to spread,"
殖民地,zhi2 min2 di4,"colony,"
步伐,bu4 fa2,"pace, (measured) step, march,"
挫折,cuo4 zhe2,"setback, reverse, check, defeat, frustration, disappointment, to frustrate, to discourage, to set sb back, to blunt, to subdue,"
啟示,qi3 shi4,"enlightenment, revelation, apocalypse,"
手藝,shou3 yi4,"craftmanship, workmanship, handicraft, trade,"
溪,xi1,"variant of 溪, creek, rivulet,"
遍布,bian4 bu4,"to cover the whole (area), to be found throughout,"
動態,dong4 tai4,"development, trend, dynamic state, movement, moving,"
工夫,gong1 fu1,"time, spare time, skill, labor, effort,"
決策,jue2 ce4,"strategic decision, decision-making, policy decision, to determine policy,"
疏忽,shu1 hu5,"to neglect, to overlook, negligence, carelessness,"
貝殼,bei4 ke2,"shell, conch, cowry, mother of pearl, hard outer skin, alternative reading , mostly written,"
連鎖,lian2 suo3,"to interlock, to be linked, chain (store etc),"
乞丐,qi3 gai4,"beggar,"
饒恕,rao2 shu4,"to forgive, to pardon, to spare,"
施展,shi1 zhan3,"to use fully, to put to use,"
虛假,xu1 jia3,"false, phony, pretense,"
草率,cao3 shuai4,"careless, negligent, sloppy, not serious,"
沸騰,fei4 teng2,"boiling, ebullition,"
緊迫,jin3 po4,"pressing, urgent,"
冒充,mao4 chong1,"to feign, to pretend to be, to pass oneself off as,"
習俗,xi2 su2,"custom, tradition, local tradition, convention,"
想方設法,xiang3 fang1 she4 fa3,"to think up every possible method (idiom); to devise ways and means, to try this, that and the other,"
衷心,zhong1 xin1,"heartfelt, wholehearted, cordial,"
備份,bei4 fen4,"backup,"
充實,chong1 shi2,"rich, full, substantial, to enrich, to augment, to substantiate (an argument),"
儲備,chu3 bei4,"reserves, to store up,"
觀光,guan1 guang1,"to tour, sightseeing, tourism,"
糾紛,jiu1 fen1,"a dispute, entanglement (law),"
下屬,xia4 shu3,"subordinate, underling,"
