hanzi,pinyin,english
周邊,zhou1 bian1,"periphery, rim, also written 周邊|周边,"
頒發,ban1 fa1,"to issue, to promulgate, to award,"
領事館,ling3 shi4 guan3,"consulate,"
領土,ling3 tu3,"territory,"
滲透,shen4 tou4,"to permeate, to infiltrate, to pervade, osmosis,"
宣揚,xuan1 yang2,"to proclaim, to make public or well known,"
起草,qi3 cao3,"draft (a bill), draw up (plans),"
起源,qi3 yuan2,"origin, to originate, to come from,"
妥當,tuo3 dang5,"appropriate, proper, ready,"
嚮往,xiang4 wang3,"to yearn for, to look forward to,"
智能,zhi4 neng2,"intelligent, able, smart (phone, system, bomb etc),"
必定,bi4 ding4,"be bound to, be sure to,"
顧慮,gu4 lu:4,"misgivings, apprehensions,"
經費,jing1 fei4,"funds, expenditure, CL:筆|笔[bǐ],"
美滿,mei3 man3,"happy, blissful,"
施加,shi1 jia1,"to exert (effort or pressure),"
思緒,si1 xu4,"train of thought, emotional state, mood, feeling,"
繁殖,fan2 zhi2,"to breed, to reproduce, to propagate,"
收縮,shou1 suo1,"to pull back, to shrink, to contract,"
詞匯,ci2 hui4,"vocabulary, list of words (e.g. for language teaching purposes),"
大致,da4 zhi4,"more or less, roughly, approximately,"
堵塞,du3 se4,"to block, to stop, blockage,"
欽佩,qin1 pei4,"to admire, to look up to, to respect sb greatly,"
圓滿,yuan2 man3,"satisfactory, consummate, perfect,"
便條,bian4 tiao2,"(informal) note, CL:張|张,個|个[gè],"
表態,biao3 tai4,"to declare one's position, to say where one stands,"
不得已,bu4 de2 yi3,"to act against one's will, to have no alternative but to, to have to, to have no choice, must,"
反饋,fan3 kui4,"to send back information, feedback,"
貨幣,huo4 bi4,"currency, monetary, money,"
沐浴,mu4 yu4,"to take a bath, to bathe, to immerse,"
樹立,shu4 li4,"to set up, to establish,"
維生素,wei2 sheng1 su4,"vitamin,"
主導,zhu3 dao3,"to lead, to manage,"
冷卻,leng3 que4,"to cool off, cooling,"
協商,xie2 shang1,"to consult with, to talk things over, agreement,"
大臣,da4 chen2,"chancellor (of a monarchy), cabinet minister,"
管轄,guan3 xia2,"to administer, to have jurisdiction (over),"
皺紋,zhou4 wen2,"wrinkle, CL:道[dào],"
潮濕,chao2 shi1,"damp, moist,"
抽空,chou1 kong4,"to find the time to do sth,"
間接,jian4 jie1,"indirect,"
擴張,kuo4 zhang1,"expansion, dilation, to expand (e.g. one's power or influence), to broaden,"
籠罩,long3 zhao4,"to envelop, to shroud,"
派遣,pai4 qian3,"to send (on a mission), to dispatch,"
偏僻,pian1 pi4,"remote, desolate, far from the city,"
起伏,qi3 fu2,"to move up and down, to undulate, ups and downs,"
山脈,shan1 mai4,"mountain range, CL:條|条[tiáo],"
掰,bai1,"to break with both hands,"
差距,cha1 ju4,"disparity, gap,"
持久,chi2 jiu3,"lasting, enduring, persistent, permanent, protracted, endurance, persistence, to last long,"
崇高,chong2 gao1,"majestic, sublime,"
共鳴,gong4 ming2,"resonance (physics), sympathetic response to sth,"
話筒,hua4 tong3,"microphone, (telephone) receiver, handset,"
堅固,jian1 gu4,"firm, firmly, hard, stable,"
調節,tiao2 jie2,"to adjust, to regulate, to harmonize, to reconcile (accountancy etc),"
務必,wu4 bi4,"must, to need to, to be sure to,"
攢,cuan2,"to collect, to hoard, to accumulate, to save,"
債券,zhai4 quan4,"bond, debenture,"
眾所周知,zhong4 suo3 zhou1 zhi1,"see 眾所周知|众所周知[zhòng suǒ zhōu zhī],"
稱號,cheng1 hao4,"name, term of address, title,"
調動,diao4 dong4,"to transfer, to maneuver (troops etc), to mobilize, to bring into play,"
埋怨,man2 yuan4,"to complain, to grumble (about), to reproach, to blame,"
慎重,shen4 zhong4,"cautious, careful, prudent,"
微不足道,wei1 bu4 zu2 dao4,"negligible, insignificant,"
預兆,yu4 zhao4,"omen, prognosis (in medicine),"
重心,zhong4 xin1,"center of gravity, central core, main part,"
籌備,chou2 bei4,"preparations, to get ready for sth,"
國防,guo2 fang2,"national defense,"
選拔,xuan3 ba2,"to select the best,"
追究,zhui1 jiu1,"to investigate, to look into,"
抵制,di3 zhi4,"to resist, to boycott, to refuse (to cooperate), to reject, resistance, refusal,"
行列,hang2 lie4,"procession,"
聯想,Lian2 xiang3,"to associate (cognitively), to make an associative connection, mental association, word prediction and auto-complete functions of input method editing programs,"
難免,nan2 mian3,"hard to avoid, difficult to escape from,"
配偶,pei4 ou3,"consort, mate, spouse,"
漂浮,piao1 fu2,"to float, to hover, to drift (also fig., to lead a wandering life), to rove, showy, superficial,"
前景,qian2 jing3,"foreground, vista, (future) prospects, perspective,"
示威,shi4 wei1,"to demonstrate (as a protest), a demonstration, a military show of force,"
巷,xiang4,"lane, alley,"
廢除,fei4 chu2,"to abolish, to abrogate, to repeal,"
恨不得,hen4 bu5 de5,"wishing one could do sth, to hate to be unable, itching to do sth, can't wait for, to wish one could do sth, to desire strongly,"
計較,ji4 jiao4,"to bother about, to haggle, to bicker, to argue, plan, stratagem,"
寂靜,ji4 jing4,"quiet,"
敏捷,min3 jie2,"nimble, quick, shrewd,"
器材,qi4 cai2,"equipment, material,"
權益,quan2 yi4,"rights and benefits,"
閃爍,shan3 shuo4,"flickering, twinkling, evasive, vague (of speech),"
四肢,si4 zhi1,"the four limbs of the body,"
豐盛,feng1 sheng4,"rich, sumptuous,"
嗅覺,xiu4 jue2,"sense of smell,"
制裁,zhi4 cai2,"to punish, punishment, sanctions (incl. economic),"
過濾,guo4 lu:4,"to filter, filter,"
渺小,miao3 xiao3,"minute, tiny, negligible, insignificant,"
分泌,fen1 mi4,"to secrete, secretion,"
腐蝕,fu3 shi2,"corrosion, to corrode (degrade chemically), to rot, corruption,"
胡亂,hu2 luan4,"careless, reckless, casually, absent-mindedly, at will, at random, any old how,"
加工,jia1 gong1,"to process, processing, working (of machinery),"
特長,te4 chang2,"personal strength, one's special ability or strong points,"
振奮,zhen4 fen4,"to stir oneself up, to raise one's spirits, to inspire,"
高峰,gao1 feng1,"peak, summit, height,"
借助,jie4 zhu4,"to draw support from, with the help of,"
流露,liu2 lu4,"to express, to reveal (one's thoughts or feelings),"
啟程,qi3 cheng2,"to set out on a journey,"
傾斜,qing1 xie2,"to incline, to lean, to slant, to slope, to tilt,"
瘸,que2,"lame,"
相應,xiang1 ying4,"to correspond, answering (one another), to agree (among the part), corresponding, relevant, appropriate, (modify) accordingly,"
承辦,cheng2 ban4,"to undertake, to accept a contract,"
倒閉,dao3 bi4,"to go bankrupt, to close down,"
混淆,hun4 xiao2,"to obscure, to confuse, to mix up, to blur, to mislead,"
機動,ji1 dong4,"locomotive, motorized, power-driven, adaptable, flexible (use, treatment, timing etc),"
氣概,qi4 gai4,"lofty quality, mettle, spirit,"
事跡,shi4 ji4,"deed, past achievement, important event of the past,"
搖晃,yao2 huang4,"to rock, to shake, to sway,"
遺失,yi2 shi1,"to lose, lost,"
冤枉,yuan1 wang5,"hatred, injustice, bad luck, unjust treatment, wronged, not worthwhile,"
逼迫,bi1 po4,"to force, to compel, to coerce,"
富裕,Fu4 yu4,"prosperous, well-to-do, well-off,"
禮節,li3 jie2,"etiquette,"
書籍,shu1 ji2,"books, works,"
表決,biao3 jue2,"to decide by vote, to vote,"
惦記,dian4 ji4,"to think of, to keep thinking about, to be concerned about,"
和藹,he2 ai3,"kindly, nice, amiable,"
枯燥,ku1 zao4,"dry and dull, uninteresting, dry-as-dust,"
皮革,pi2 ge2,"leather, CL:張|张[zhāng],"
平原,ping2 yuan2,"field, plain, CL:個|个[gè],"
盛,Sheng4,"to hold, to contain, to ladle, to pick up with a utensil,"
公告,gong1 gao4,"post, announcement,"
記性,ji4 xing5,"memory,"
衰老,shuai1 lao3,"to age, to deteriorate with age, old and weak,"
正規,zheng4 gui1,"regular, according to standards,"
粉末,fen3 mo4,"fine powder, dust,"
平面,ping2 mian4,"plane (flat surface), print media,"
掀起,xian1 qi3,"to lift, to raise in height, to begin, upsurge, to set off (a campaign),"
轉達,zhuan3 da2,"to pass on, to convey, to communicate,"
愛戴,ai4 dai4,"to love and respect, love and respect,"
貶低,bian3 di1,"to belittle, to disparage, to play down, to demean, to degrade, to devalue,"
空洞,kong1 dong4,"cavity, empty, vacuous,"
冷淡,leng3 dan4,"cold, indifferent,"
猛烈,meng3 lie4,"fierce, violent (criticism etc),"
探討,tan4 tao3,"to investigate, to probe,"
心態,xin1 tai4,"attitude (of the heart), state of one's psyche, way of thinking, mentality,"
支柱,zhi1 zhu4,"mainstay, pillar, prop, backbone,"
辮子,bian4 zi5,"plait, braid, pigtail, a mistake or shortcoming that may be exploited by an opponent, handle, CL:根,條|条[tiáo],"
國務院,Guo2 wu4 yuan4,"State Council (PRC), State Department (USA),"
胸膛,xiong1 tang2,"chest,"
岳父,yue4 fu4,"wife's father, father-in-law,"
繁忙,fan2 mang2,"busy, bustling,"
寬敞,kuan1 chang5,"spacious, wide,"
民間,min2 jian1,"among the people, popular, folk, non-governmental, involving people rather than governments,"
商標,shang1 biao1,"trademark, logo,"
受罪,shou4 zui4,"to endure, to suffer, hardships, torments, a hard time, a nuisance,"
體諒,ti3 liang4,"to empathize, to allow (for something), to show understanding, to appreciate,"
無動於衷,wu2 dong4 yu2 zhong1,"aloof, indifferent, unconcerned,"
瀕臨,bin1 lin2,"on the verge of, close to,"
湊合,cou4 he5,"to bring together, to make do in a bad situation, to just get by, to improvise, passable, not too bad,"
定期,ding4 qi1,"regularly, at regular intervals,"
風味,feng1 wei4,"local flavor, local style,"
根源,gen1 yuan2,"origin, root (cause),"
過渡,guo4 du4,"to cross over (by ferry), transition, interim, caretaker (administration),"
見解,jian4 jie3,"opinion, view, understanding,"
健全,jian4 quan2,"robust, sound,"
氫,qing1,"hydrogen (chemistry),"
熨,yu4,"an iron, to iron,"
中立,zhong1 li4,"neutral,"
急切,ji2 qie4,"eager, impatient,"
開展,kai1 zhan3,"(begin to) develop, unfold, to start, to launch, to open, to carry out,"
諒解,liang4 jie3,"to understand, to make allowances for, understanding,"
臺風,tai2 feng1,"hurricane, typhoon,"
自主,zi4 zhu3,"independent, to act for oneself, autonomous,"
不時,bu4 shi2,"from time to time, now and then, occasionally,"
暢銷,chang4 xiao1,"to sell well, best seller, chart-topping,"
大肆,da4 si4,"wantonly, without restraint (of enemy or malefactor), unbridled,"
斷定,duan4 ding4,"to conclude, to determine, to come to a judgment,"
款式,kuan3 shi4,"pattern, style, design, CL:種|种[zhǒng],"
徒弟,tu2 di4,"apprentice, disciple,"
猶如,you2 ru2,"similar to, appearing to be,"
儲蓄,chu3 xu4,"to deposit money, to save, savings,"
肖像,xiao4 xiang4,"portrait,"
修建,xiu1 jian4,"to build, to construct,"
照耀,zhao4 yao4,"to shine, to illuminate,"
橙,cheng2,"orange tree, orange (color),"
可口,ke3 kou3,"tasty, to taste good,"
懶惰,lan3 duo4,"idle, lazy,"
盤旋,pan2 xuan2,"to spiral, to circle, to go around, to hover, to orbit,"
小心翼翼,xiao3 xin1 yi4 yi4,"cautious and solemn (idiom); very carefully, prudent, gently and cautiously,"
個體,ge4 ti3,"individual,"
默默,mo4 mo4,"in silence, not speaking,"
生銹,sheng1 xiu4,"to rust, to grow rusty, to corrode, oxidization,"
彈性,tan2 xing4,"flexibility, elasticity,"
題材,ti2 cai2,"subject matter,"
文物,wen2 wu4,"cultural relic, historical relic, CL:件,個|个[gè],"
糟蹋,zao1 ta4,"to waste, to defile, to abuse, to insult, to defile, to trample on, to wreck, also pr. [zāo ta],"
叼,diao1,"to hold in the mouth,"
海濱,hai3 bin1,"shore, seaside,"
就職,jiu4 zhi2,"to take office, to assume a post,"
贈送,zeng4 song4,"to present as a gift,"
二氧化碳,er4 yang3 hua4 tan4,"carbon dioxide CO2,"
輪廓,lun2 kuo4,"an outline, silhouette,"
門診,men2 zhen3,"outpatient service,"
委員,wei3 yuan2,"committee member, committee, council, CL:個|个[gè],"
無從,wu2 cong2,"not to have access, beyond one's authority or capability, sth one has no way of doing,"
演變,yan3 bian4,"to develop, to evolve,"
分明,fen1 ming2,"clearly demarcated, sharply contoured,"
規範,gui1 fan4,"norm, standard, specification, regulation, rule, within the rules, to fix rules, to regulate, to specify,"
烘,hong1,"to bake, to heat by fire, to set off by contrast,"
晉升,jin4 sheng1,"to promote to a higher position,"
靈敏,ling2 min3,"smart, clever, sensitive, keen, quick, sharp,"
不禁,bu4 jin1,"can't help (doing sth), can't refrain from,"
創立,chuang4 li4,"to establish, to set up, to found,"
鉤子,gou1 zi5,"hook,"
境界,jing4 jie4,"boundary, state, realm,"
口頭,kou3 tou2,"oral, verbal,"
氣壓,qi4 ya1,"atmospheric pressure, barometric pressure,"
恰巧,qia4 qiao3,"fortunately, unexpectedly, by coincidence,"
劇烈,ju4 lie4,"violent, acute, severe, fierce,"
情理,qing2 li3,"reason, sense,"
任性,ren4 xing4,"willful, headstrong, uninhibited,"
嚴峻,yan2 jun4,"grim, severe, rigorous,"
駐紮,zhu4 zha1,"to station, to garrison (troops),"
莊嚴,zhuang1 yan2,"stately,"
不愧,bu4 kui4,"to be worthy of, to deserve to be called, to prove oneself to be,"
充當,chong1 dang1,"to serve as, to act as, to play the role of,"
蹬,deng1,"to step on, to tread on, to wear, Taiwan pr. [dèng],"
反面,fan3 mian4,"reverse side, backside, the other side (of a problem etc), negative, bad,"
含糊,han2 hu5,"obscurity, vague,"
呼籲,hu1 yu4,"to call on (sb to do sth), to appeal (to), an appeal,"
氣勢,qi4 shi4,"imposing manner, loftiness, grandeur, energetic looks, vigor,"
辛勤,xin1 qin2,"hardworking, industrious,"
卓越,zhuo2 yue4,"outstanding, surpassing, distinguished, splendid,"
擱,ge1,"to place, to put aside, to shelve,"
公然,gong1 ran2,"openly, publicly, undisguised,"
過癮,guo4 yin3,"to satisfy a craving, to get a kick out of sth, gratifying, immensely enjoyable, satisfying, fulfilling,"
堅硬,jian1 ying4,"hard, solid,"
領悟,ling3 wu4,"to understand, to comprehend,"
篩選,shai1 xuan3,"to filter,"
週期,zhou1 qi1,"period, cycle,"
資本,zi1 ben3,"capital (economics),"
安詳,an1 xiang2,"serene,"
逢,feng2,"to meet by chance, to come across, to fawn upon,"
高超,gao1 chao1,"excellent, superlative,"
高漲,gao1 zhang3,"upsurge, (tensions etc) run high,"
寄託,ji4 tuo1,"to have sb look after sb, to entrust the care of sb, to place (hope etc) on,"
論壇,lun4 tan2,"forum (for discussion),"
齊心協力,qi2 xin1 xie2 li4,"to work with a common purpose (idiom); to make concerted efforts, to pull together, to work as one,"
上任,shang4 ren4,"to take office,"
實質,shi2 zhi4,"substance, essence,"
素質,su4 zhi4,"inner quality, basic essence, change over time,"
頑強,wan2 qiang2,"tenacious, hard to defeat,"
文憑,wen2 ping2,"diploma,"
資深,zi1 shen1,"senior (in terms of depth of accumulated experience), deeply qualified,"
倉促,cang1 cu4,"all of a sudden, hurriedly,"
鑑別,jian4 bie2,"to differentiate, to distinguish,"
蔑視,mie4 shi4,"to loathe, to despise, contempt,"
名額,ming2 e2,"quota, number of places, place (in an institution, a group etc),"
通用,tong1 yong4,"common (use), interchangeable,"
擁護,yong1 hu4,"to endorse, to support,"
鄭重,zheng4 zhong4,"serious, solemn,"
採購,cai3 gou4,"to procure (for an enterprise etc), to purchase,"
採納,cai3 na4,"to accept, to adopt,"
醜惡,chou3 e4,"ugly, repulsive,"
攪拌,jiao3 ban4,"to stir, to agitate,"
片斷,pian4 duan4,"section, fragment, segment,"
橋梁,qiao2 liang2,"bridge, fig. connection between two areas,"
著作,zhu4 zuo4,"to write, literary work, book, article, writings, CL:部[bù],"
被動,bei4 dong4,"passive,"
甭,beng2,"need not, (contraction of 不 and 用),"
機智,ji1 zhi4,"quick-witted, tact, witty, resourceful,"
踐踏,jian4 ta4,"to trample,"
密度,mi4 du4,"density, thickness,"
人道,ren2 dao4,"human sympathy, humanitarianism, humane, the ""human way"", one of the stages in the cycle of reincarnation (Buddhism), sexual intercourse,"
柔和,rou2 he2,"gentle, soft,"
尋覓,xun2 mi4,"to look for,"
大意,da4 yi4,"careless,"
花瓣,hua1 ban4,"petal, CL:片[piàn],"
領會,ling3 hui4,"to understand, to comprehend, to grasp,"
恰到好處,qia4 dao4 hao3 chu4,"it's just perfect, it's just right,"
推論,tui1 lun4,"to infer, inference, corollary, reasoned conclusion,"
走漏,zou3 lou4,"to leak (of information, liquid etc), to divulge,"
顛簸,dian1 bo3,"to shake, to jolt, to bump,"
飛躍,fei1 yue4,"to leap,"
精華,jing1 hua2,"best feature, most important part of an object, quintessence, essence, soul,"
開闊,kai1 kuo4,"wide, open (spaces), to open up,"
配備,pei4 bei4,"to allocate, to provide, to outfit with,"
調料,tiao2 liao4,"condiment, seasoning, flavoring,"
土壤,tu3 rang3,"soil,"
外行,wai4 hang2,"layman, amateur,"
陣地,zhen4 di4,"position, front,"
支出,zhi1 chu1,"to spend, to pay out, expense,"
座右銘,zuo4 you4 ming2,"motto, maxim,"
標本,biao1 ben3,"specimen, sample, the root cause and symptoms of a disease,"
兌換,dui4 huan4,"to convert, to exchange,"
分量,fen1 liang4,"quantity, weight, measure,"
理睬,li3 cai3,"to heed, to pay attention to,"
留神,liu2 shen2,"to take care, to be careful,"
凝視,ning2 shi4,"to gaze at, to fix one's eyes on,"
生態,sheng1 tai4,"way of life, ecology,"
信譽,xin4 yu4,"prestige, distinction, reputation, trust,"
對策,dui4 ce4,"countermeasure for dealing with a situation,"
黃昏,huang2 hun1,"dusk, evening, nightfall,"
揮霍,hui1 huo4,"to squander money, extravagant, prodigal, free and easy, agile,"
請教,qing3 jiao4,"to ask for guidance, to consult,"
哨,shao4,"a whistle, sentry,"
私自,si1 zi4,"private, personal, secretly, without explicit approval,"
洩氣,xie4 qi4,"to leak (gas), to be discouraged, to despair, (disparaging) pathetic, to vent one's anger, (of a tire) to be flat,"
形態,xing2 tai4,"shape, form, pattern, morphology,"
薄弱,bo2 ruo4,"weak, frail,"
還原,huan2 yuan2,"to restore to the original state, reduction (chemistry),"
精密,jing1 mi4,"accuracy, exact, precise, refined,"
牢固,lao2 gu4,"firm, secure,"
起義,qi3 yi4,"uprising, insurrection, revolt,"
全局,quan2 ju2,"overall situation,"
遺留,yi2 liu2,"(leave or be a) legacy, left over, hand down (to next generation),"
雜技,za2 ji4,"acrobatics, CL:場|场[chǎng],"
遭殃,zao1 yang1,"to suffer a calamity,"
得力,de2 li4,"able, capable, competent, efficient,"
晾,liang4,"to dry in the air,"
人為,ren2 wei2,"artificial, man-made, having human cause or origin, human attempt or effort,"
神仙,shen2 xian1,"Daoist immortal, supernatural entity, (in modern fiction) fairy, elf, leprechaun etc, fig. lighthearted person,"
提拔,ti2 ba2,"to promote to a higher job, to select for promotion,"
瓦解,wa3 jie3,"to collapse, to disintegrate, to crumble,"
顯著,xian3 zhu4,"outstanding, notable, remarkable, statistically significant,"
削弱,xue1 ruo4,"to weaken, to impair, to cripple,"
一度,yi1 du4,"for a time, at one time, one time, once,"
以致,yi3 zhi4,"to such an extent as to, down to, up to,"
鎮壓,zhen4 ya1,"suppression, repression, to suppress, to put down, to quell,"
波浪,bo1 lang4,"wave,"
裁員,cai2 yuan2,"to cut staff, to lay off employees,"
垂直,chui2 zhi2,"perpendicular, vertical,"
告辭,gao4 ci2,"to say goodbye, to take one's leave,"
悔恨,hui3 hen4,"remorse, repentance,"
結晶,jie2 jing1,"crystallization, crystalline, crystal,"
可觀,ke3 guan1,"considerable, impressive, significant,"
請柬,qing3 jian3,"invitation card, written invitation,"
數額,shu4 e2,"amount, sum of money, fixed number,"
用功,yong4 gong1,"diligent, industrious (in one's studies), to study hard, to make great effort,"
誠摯,cheng2 zhi4,"sincere, cordial,"
膽怯,dan3 qie4,"timid, cowardly,"
公式,gong1 shi4,"formula,"
局部,ju2 bu4,"part, local,"
齊全,qi2 quan2,"complete,"
陶瓷,tao2 ci2,"pottery and porcelain, ceramics,"
未免,wei4 mian3,"unavoidable, a bit too much, over the top (you exaggerate),"
指南針,zhi3 nan2 zhen1,"compass,"
搓,cuo1,"to rub or roll between the hands or fingers, to twist,"
雕刻,diao1 ke4,"to carve, to engrave, carving,"
腐朽,fu3 xiu3,"rotten, decayed, decadent, degenerate,"
公認,gong1 ren4,"publicly known (to be), accepted (as),"
規章,gui1 zhang1,"rule, regulation,"
合乎,he2 hu1,"to accord with, conforming to,"
階層,jie1 ceng2,"hierarchy, stratum,"
來歷,lai2 li4,"history, antecedents, origin,"
懸念,xuan2 nian4,"suspense in a movie, play etc, concern for sb's welfare,"
補貼,bu3 tie1,"to subsidize, subsidy, allowance,"
匪徒,fei3 tu2,"gangster, bandit,"
告誡,gao4 jie4,"to warn, to admonish,"
間隔,jian4 ge2,"compartment, gap, interval, to divide,"
交涉,jiao1 she4,"to negotiate, relating to,"
內涵,nei4 han2,"meaning, content, essential properties implied or reflected by a notion, intention, connotation, self-possessed,"
源泉,yuan2 quan2,"fountainhead, well-spring, water source, fig. origin,"
總而言之,zong3 er2 yan2 zhi1,"in short, in a word, in brief,"
阻撓,zu3 nao2,"to thwart, to obstruct (sth),"
保養,bao3 yang3,"to take good care of (or conserve) one's health, to keep in good repair, to maintain, maintenance,"
沉悶,chen2 men4,"oppressive (of weather), heavy, depressed, not happy,"
課題,ke4 ti2,"task, problem, issue,"
留戀,liu2 lian4,"reluctant to leave, to hate to have to go, to recall fondly,"
慢性,man4 xing4,"slow and patient, chronic (disease), slow to take effect (e.g. a slow poison),"
牲畜,sheng1 chu4,"domesticated animals, livestock,"
涮,shuan4,"to rinse, to trick, to fool sb, to cook by dipping finely sliced ingredients briefly in boiling water or soup (generally done at the dining table),"
歪曲,wai1 qu1,"to distort, to misrepresent,"
學歷,xue2 li4,"educational background, academic qualifications,"
巴不得,ba1 bu5 de5,"to be eager for, to long for, to look forward to,"
半途而廢,ban4 tu2 er2 fei4,"to give up halfway (idiom); leave sth unfinished,"
沉思,chen2 si1,"to contemplate, to ponder, contemplation, meditation,"
檔次,dang4 ci4,"grade, class, quality, level,"
島嶼,dao3 yu3,"island,"
立體,li4 ti3,"three-dimensional, solid, stereoscopic,"
簽訂,qian1 ding4,"to agree to and sign (a treaty etc),"
時差,shi2 cha1,"time difference, time lag, jet lag,"
衰退,shuai1 tui4,"to decline, to fall, to drop, to falter, a decline, recession (in economics),"
調解,tiao2 jie3,"to mediate, to bring parties to an agreement,"
物資,wu4 zi1,"goods, supplies,"
變質,bian4 zhi4,"to degenerate, to go bad, to deteriorate, metamorphosis,"
剝削,bo1 xue1,"to exploit, exploitation,"
對應,dui4 ying4,"to correspond, a correspondence, corresponding, homologous, matching with sth, counterpart,"
航天,hang2 tian1,"space flight,"
水龍頭,shui3 long2 tou2,"faucet, tap,"
輿論,yu2 lun4,"public opinion,"
醞釀,yun4 niang4,"(of alcohol) to ferment, (of a crisis) to be brewing, to mull over (an issue), to hold exploratory discussions,"
造反,zao4 fan3,"to rebel, to revolt,"
爭端,zheng1 duan1,"dispute, controversy, conflict,"
株,zhu1,"tree trunk, stump (tree root), a plant, classifier for trees or plants, to involve others (in shady business),"
主流,zhu3 liu2,"main stream (of a river), fig. the essential point, main viewpoint of a matter, mainstream (culture etc),"
編織,bian1 zhi1,"to weave, to knit, to plait, to braid,"
跟前,gen1 qian2,"in front of, close to, nearby, the time just before,"
槳,jiang3,"oar, paddle,"
咀嚼,ju3 jue2,"to chew, to think over,"
愣,leng4,"to look distracted, to stare blankly, distracted, blank, (coll.) unexpectedly, rash, rashly,"
誣陷,wu1 xian4,"to entrap, to frame, to plant false evidence against sb,"
無理取鬧,wu2 li3 qu3 nao4,"to make trouble without reason (idiom); to be deliberately provocative,"
報銷,bao4 xiao1,"to submit an expense account, to apply for reimbursement, to write off, to wipe out,"
敷衍,fu1 yan3,"to elaborate (on a theme), to expound (the classics), perfunctory, to skimp, to botch, to do sth half-heartedly or just for show, barely enough to get by,"
廣闊,guang3 kuo4,"wide, vast,"
考古,kao3 gu3,"archaeology,"
捆綁,kun3 bang3,"to bind,"
彌漫,mi2 man4,"variant of 彌漫|弥漫[mí màn],"
趣味,qu4 wei4,"fun, interest, delight, taste, liking, preference,"
容貌,rong2 mao4,"one's appearance, one's aspect, looks, features,"
容納,rong2 na4,"to hold, to contain, to accommodate, to tolerate (different opinions),"
天然氣,tian1 ran2 qi4,"natural gas,"
阻攔,zu3 lan2,"to stop, to obstruct,"
傳授,chuan2 shou4,"to impart, to pass on, to teach,"
朗讀,lang3 du2,"read aloud, read loudly and clearly,"
名副其實,ming2 fu4 qi2 shi2,"not just in name only, but also in reality (idiom),"
破例,po4 li4,"to make an exception,"
神情,shen2 qing2,"look, expression,"
生機,sheng1 ji1,"opportunity to live, to reprieve from death, life force, vitality,"
長輩,zhang3 bei4,"one's elders, older generation,"
租賃,zu1 lin4,"to rent, to lease, to hire,"
和睦,he2 mu4,"peaceful relations, harmonious,"
候選,hou4 xuan3,"candidate,"
就業,jiu4 ye4,"looking for employment, getting a job, to start a career,"
拘束,ju1 shu4,"to restrict, to restrain, constrained, awkward, ill at ease, uncomfortable, reticent,"
侷限,ju2 xian4,"to limit, to confine, to restrict sth within set boundaries,"
連同,lian2 tong2,"together with, along with,"
上游,shang4 you2,"upper reaches (of a river), upper level, upper echelon, upstream,"
閒話,xian2 hua4,"digression, gossip, complaint, scandal, CL:段[duàn],"
響應,xiang3 ying4,"respond to, answer, CL:個|个[gè],"
宗旨,zong1 zhi3,"objective, aim, goal,"
抱負,bao4 fu4,"aspiration, ambition,"
幹勁,gan4 jin4,"enthusiasm for doing sth,"
