hanzi,pinyin,english
開朗,kai1 lang3,"spacious and well-lit, open and clear, to open out (onto a wider vista), optimistic, cheerful, carefree, easy-going, open-minded,"
口腔,kou3 qiang1,"oral cavity,"
凝固,ning2 gu4,"to freeze, to solidify, to congeal, fig. with rapt attention,"
晴朗,qing2 lang3,"sunny and cloudless,"
停頓,ting2 dun4,"to halt, to break off, pause (in speech),"
一再,yi1 zai4,"repeatedly,"
專程,zhuan1 cheng2,"special-purpose trip,"
纏繞,chan2 rao4,"twisting, to twine, to wind, to pester, to bother,"
福氣,fu2 qi5,"good fortune, to enjoy good fortune,"
更正,geng1 zheng4,"to correct, to make a correction,"
日益,ri4 yi4,"day by day, more and more, increasingly, more and more with each passing day,"
溶解,rong2 jie3,"to dissolve,"
索賠,suo3 pei2,"to ask for compensation, to claim damages, claim for damages,"
貪污,tan1 wu1,"corruption,"
傳記,zhuan4 ji4,"biography, CL:篇,部[bù],"
對稱,dui4 chen4,"symmetry, symmetrical,"
緩和,huan3 he2,"to ease (tension), to alleviate, to moderate, to allay, to make more mild,"
力所能及,li4 suo3 neng2 ji2,"as far as one's capabilities extend (idiom); to the best of one's ability, within one's powers,"
嘆氣,tan4 qi4,"to sigh, to heave a sigh,"
禿,tu1,"bald, blunt,"
盈利,ying2 li4,"profit, gain,"
曖昧,ai4 mei4,"vague, ambiguous, equivocal, dubious,"
沉著,chen2 zhuo2,"steady, calm and collected, not nervous,"
獨裁,du2 cai2,"dictatorship,"
開採,kai1 cai3,"to extract (ore or other resource from a mine), to exploit, to mine,"
惋惜,wan3 xi1,"to feel sorry for a person over sth that should have happened,"
優越,you1 yue4,"superior, superiority,"
予以,yu3 yi3,"to give, to impose, to apply,"
包庇,bao1 bi4,"to shield, to harbor, to cover up,"
條理,tiao2 li3,"arrangement, order, tidiness,"
文雅,wen2 ya3,"elegant, refined,"
鮮明,xian1 ming2,"bright, clear-cut, distinct,"
成效,cheng2 xiao4,"effect, result,"
吝嗇,lin4 se4,"stingy, mean, miserly,"
唾沫,tuo4 mo5,"spittle, saliva,"
昔日,xi1 ri4,"formerly, in olden days,"
狹窄,xia2 zhai3,"narrow,"
性能,xing4 neng2,"function, performance,"
奔波,ben1 bo1,"to rush about, to be constantly on the move,"
乘務員,cheng2 wu4 yuan2,"attendant on an airplane, train, boat etc,"
宏偉,hong2 wei3,"grand, imposing, magnificent,"
沒轍,mei2 zhe2,"(idiom) unable to solve; no way to escape a problem,"
拼搏,pin1 bo2,"to struggle, to wrestle,"
無憂無慮,wu2 you1 wu2 lu:4,"carefree and without worries (idiom),"
向來,xiang4 lai2,"always (previously),"
要素,yao4 su4,"essential factor, key constituent,"
一帆風順,yi1 fan1 feng1 shun4,"propitious wind throughout the journey (idiom), plain sailing, to go smoothly, have a nice trip!,"
勇於,yong3 yu2,"to dare to, to be brave enough to,"
孕育,yun4 yu4,"to be pregnant, to produce offspring, to nurture (a development, school of thought, artwork etc), fig. replete with (culture etc),"
莊重,zhuang1 zhong4,"grave, solemn, dignified,"
陳舊,chen2 jiu4,"old-fashioned,"
摧殘,cui1 can2,"to ravage, to ruin,"
茫茫,mang2 mang2,"boundless, vast and obscure,"
事項,shi4 xiang4,"matter, item,"
細緻,xi4 zhi4,"delicate, fine, careful, meticulous, painstaking,"
綉,xiu4,"to embroider, embroidery,"
動員,dong4 yuan2,"to mobilize, to arouse, mobilization, CL:次,個|个[gè],"
牢騷,lao2 sao1,"discontent, complaint, to complain,"
凝聚,ning2 ju4,"to condense, to coagulate, coacervation (i.e. form tiny droplets), aggregation, coherent,"
攀登,pan1 deng1,"to climb, to pull oneself up, to clamber, to scale, fig. to forge ahead in the face of hardships and danger,"
運算,yun4 suan4,"(mathematical) operation,"
次序,ci4 xu4,"sequence, order,"
復興,Fu4 xing1,"to revive, to rejuvenate,"
急躁,ji2 zao4,"irritable, irascible, impetuous,"
尖端,jian1 duan1,"sharp pointed end, the tip, the cusp, tip-top, most advanced and sophisticated, highest peak, the best,"
流通,liu2 tong1,"to circulate, to distribute, circulation, distribution,"
批判,pi1 pan4,"to criticize, critique, CL:個|个[gè],"
思索,si1 suo3,"to think deeply, to ponder,"
夕陽,xi1 yang2,"sunset, the setting sun,"
才幹,cai2 gan4,"ability, competence,"
發炎,fa1 yan2,"to become inflamed, inflammation,"
屏障,ping2 zhang4,"protective screen,"
謙遜,qian1 xun4,"humble, modest, unpretentious, modesty,"
缺口,que1 kou3,"nick, jag, gap, shortfall,"
嫂子,sao3 zi5,"(informal) older brother's wife, sister-in-law, CL:個|个[gè],"
率領,shuai4 ling3,"to lead, to command, to head,"
隨手,sui2 shou3,"conveniently, without extra trouble, while doing it, in passing,"
無非,wu2 fei1,"only, nothing else,"
現成,xian4 cheng2,"ready-made, readily available,"
愚昧,yu2 mei4,"ignorant, uneducated,"
樂譜,yue4 pu3,"a musical score, sheet music,"
展望,zhan3 wang4,"outlook, prospect, to look ahead, to look forward to,"
遲疑,chi2 yi2,"to hesitate,"
驚動,jing1 dong4,"alarm, alert, disturb,"
茫然,mang2 ran2,"blankly, vacantly, at a loss,"
遷徙,qian1 xi3,"to migrate, to move,"
曲折,qu1 zhe2,"complicated, winding,"
滔滔不絕,tao1 tao1 bu4 jue2,"unceasing torrent (idiom), talking non-stop, gabbling forty to the dozen,"
性情,xing4 qing2,"nature, temperament,"
壓縮,ya1 suo1,"to compress, compression,"
甘心,gan1 xin1,"to be willing to, to resign oneself to,"
鞏固,gong3 gu4,"to consolidate, consolidation, to strengthen,"
覺醒,jue2 xing3,"to awaken, to come to realize, awakened to the truth, the truth dawns upon one, scales fall from the eyes, to become aware,"
深沉,shen1 chen2,"deep, extreme, dull, low pitched (sound),"
示意,shi4 yi4,"to hint, to indicate (an idea to sb),"
敗壞,bai4 huai4,"to ruin, to corrupt, to undermine,"
闡述,chan3 shu4,"to expound (a position), to elaborate (on a topic), to treat (a subject),"
泛濫,fan4 lan4,"to be in flood, to overflow (the banks), to inundate, to spread unchecked,"
方言,Fang1 yan2,"dialect,"
過問,guo4 wen4,"to show an interest in, to get involved with,"
耗費,hao4 fei4,"to waste, to spend, to consume, to squander,"
培育,pei2 yu4,"to train, to breed,"
請帖,qing3 tie3,"invitation card, written invitation,"
適宜,shi4 yi2,"suitable, appropriate,"
停滯,ting2 zhi4,"stagnation, at a standstill, bogged down,"
押金,ya1 jin1,"deposit, down payment,"
嚴禁,yan2 jin4,"strictly prohibit,"
奧祕,ao4 mi4,"secret, mystery,"
表彰,biao3 zhang1,"to honor, to commend, to cite (in dispatches),"
打量,da3 liang5,"to size sb up, to take measure of, to suppose, to reckon,"
劃分,hua4 fen1,"to divide,"
焦急,jiao1 ji2,"anxiety, anxious,"
牽制,qian1 zhi4,"to control, to curb, to restrict, to impede, to pin down (enemy troops),"
權衡,quan2 heng2,"to weigh, to consider, to assess, to balance, to trade-off,"
若干,ruo4 gan1,"a certain number or amount, how many?, how much?,"
響亮,xiang3 liang4,"loud and clear, resounding,"
炎熱,yan2 re4,"blistering hot, sizzling hot (weather),"
應酬,ying4 chou5,"social niceties, social interaction, a dinner party,"
轉折,zhuan3 zhe2,"shift in the trend of events, plot shift in a book, twists and turns,"
背誦,bei4 song4,"recite, repeat from memory,"
當務之急,dang1 wu4 zhi1 ji2,"top priority job, matter of vital importance,"
對立,dui4 li4,"to oppose, to set sth against, to be antagonistic to, antithetical, relative opposite, opposing, diametrical,"
附屬,fu4 shu3,"subsidiary, auxiliary, attached, affiliated, subordinate, subordinating,"
盛開,sheng4 kai1,"blooming, in full flower,"
毅力,yi4 li4,"perseverance, willpower,"
增添,zeng1 tian1,"to add, to increase,"
自卑,zi4 bei1,"feeling inferior, self-abased,"
腹瀉,fu4 xie4,"diarrhea, to have the runs,"
隔閡,ge2 he2,"estrangement,"
後勤,hou4 qin2,"logistics,"
堅實,jian1 shi2,"firm and substantial, solid,"
譬如,pi4 ru2,"for example, for instance, such as,"
啟事,qi3 shi4,"announcement (written, on billboard, letter, newspaper or website), to post information, a notice,"
妥善,tuo3 shan4,"appropriate, proper,"
庸俗,yong1 su2,"filthy, vulgar, debased,"
指標,zhi3 biao1,"norm, index, target,"
重疊,chong2 die2,"to overlap, to superimpose, to telescope, to run together, to duplicate, one over another, superposition, an overlap, redundancy, reduplication (in Chinese grammar, e.g. 散散步 to have a stroll),"
雌雄,ci2 xiong2,"male and female,"
顆粒,ke1 li4,"kernel, granule, granulated (sugar, chemical product),"
面貌,mian4 mao4,"appearance, face, features, CL:個|个[gè],"
深奧,shen1 ao4,"profound, abstruse, recondite, profoundly,"
相差,xiang1 cha4,"to differ, discrepancy between,"
兇惡,xiong1 e4,"variant of 兇惡|凶恶, fierce, ferocious, fiendish, frightening,"
周密,zhou1 mi4,"careful, thorough,"
出息,chu1 xi1,"future prospects, profit, to mature, to grow up,"
好客,hao4 ke4,"hospitality, to treat guests well, to enjoy having guests, hospitable, friendly,"
急劇,ji2 ju4,"rapid, sudden,"
投擲,tou2 zhi4,"to throw sth a long distance, to hurl, to throw at, to throw (dice etc), to flip (a coin),"
優異,you1 yi4,"exceptional, outstandingly good,"
鑄造,zhu4 zao4,"to cast (pour metal into a mold),"
專題,zhuan1 ti2,"special topic,"
伯母,bo2 mu3,"wife of father's elder brother, aunt, (polite form of address for a woman who is about the age of one's mother), CL:個|个[gè],"
範疇,fan4 chou2,"category,"
鼓動,gu3 dong4,"to agitate, to arouse, to instigate, to encite,"
摸索,mo1 suo5,"to feel about, to grope about, to fumble, to do things slowly,"
排放,pai2 fang4,"emission, discharge, exhaust (gas etc),"
田徑,tian2 jing4,"track and field (athletics),"
雪上加霜,xue3 shang4 jia1 shuang1,"to add hail to snow (idiom); one disaster on top of another, to make things worse in a bad situation,"
致辭,zhi4 ci2,"to express in words or writing, to make a speech (esp. short introduction, vote of thanks, afterword, funeral homily etc), to address (an audience), same as 致詞|致词,"
轉讓,zhuan3 rang4,"transfer (technology, goods etc), conveyancing (property),"
百分點,bai3 fen1 dian3,"percentage point,"
博覽會,bo2 lan3 hui4,"exposition, international fair,"
佈局,bu4 ju2,"arrangement, composition, layout, opening (chess jargon),"
改良,gai3 liang2,"to improve,"
解體,jie3 ti3,"to break up into components, to disintegrate, to collapse, to crumble,"
利害,li4 hai4,"pros and cons, advantages and disadvantages, gains and losses,"
輪船,lun2 chuan2,"steamship, steamer, ocean liner, ship, CL:艘[sōu],"
遷就,qian1 jiu4,"to yield, to adapt to, to accommodate to (sth),"
飼養,si4 yang3,"to raise, to rear,"
腥,xing1,"fishy (smell),"
休養,xiu1 yang3,"to recuperate, to recover, to convalesce,"
舟,zhou1,"boat,"
作廢,zuo4 fei4,"to become invalid, to cancel, to delete, to nullify,"
不像話,bu4 xiang4 hua4,"unreasonable, shocking, outrageous,"
反思,fan3 si1,"to think back over sth, to review, to revisit, to rethink, reflection, reassessment,"
規格,gui1 ge2,"standard, norm, specification,"
果斷,guo3 duan4,"firm, decisive,"
簡化,jian3 hua4,"to simplify,"
簡陋,jian3 lou4,"simple and crude (of a room or building),"
提煉,ti2 lian4,"to extract (ore, minerals etc), to refine, to purify, to process,"
唯獨,wei2 du2,"only, just (i.e. it is only that...), all except, unique,"
陣容,zhen4 rong2,"troop arrangement, battle formation, line-up (of a sports team etc),"
嘈雜,cao2 za2,"noisy, clamorous,"
地質,di4 zhi4,"geology,"
發呆,fa1 dai1,"to stare blankly, to be stunned, to be lost in thought,"
方針,fang1 zhen1,"policy, guidelines, CL:個|个[gè],"
分紅,fen1 hong2,"a bonus, to award a bonus,"
附件,fu4 jian4,"enclosure, attachment (email), appendix,"
乾旱,gan1 han4,"drought, arid, dry,"
格式,ge2 shi4,"form, specification, format,"
號召,hao4 zhao4,"to call, to appeal,"
荒涼,huang1 liang2,"desolate,"
空想,kong1 xiang3,"daydream, fantasy, to fantasize,"
筐,kuang1,"basket, CL:隻|只[zhī],"
狼狽,lang2 bei4,"in a difficult situation, to cut a sorry figure, scoundrel! (derogatory),"
里程碑,li3 cheng2 bei1,"milestone,"
悽涼,qi1 liang2,"desolate,"
清澈,qing1 che4,"clear, limpid,"
腮,sai1,"cheek,"
投機,tou2 ji1,"to speculate (on financial markets), opportunistic, congenial, agreeable,"
團圓,tuan2 yuan2,"to have a reunion,"
致使,zhi4 shi3,"to cause, to result in,"
頒布,ban1 bu4,"to issue, to proclaim, to enact (laws, decrees etc),"
參照,can1 zhao4,"to consult a reference, to refer to (another document),"
反倒,fan3 dao4,"but on the contrary, but expectedly,"
豐收,feng1 shou1,"bumper harvest,"
化石,hua4 shi2,"fossil,"
切實,qie4 shi2,"feasible, earnestly, conscientiously, realistic, practical,"
爽快,shuang3 kuai5,"refreshed, rejuvenated, frank and straightforward,"
無精打采,wu2 jing1 da3 cai3,"dispirited and downcast (idiom); listless, in low spirits, washed out,"
照應,zhao4 ying4,"to correlate with, to correspond to,"
迸發,beng4 fa1,"to burst forth,"
秤,cheng1,"steelyard, Roman balance, CL:臺|台[tái],"
董事長,dong3 shi4 zhang3,"chairman of the board, chairman,"
幅度,fu2 du4,"width, extent, range, scope,"
簡要,jian3 yao4,"concise, brief,"
開明,kai1 ming2,"enlightened, open-minded, enlightenment,"
抹殺,mo3 sha1,"to erase, to cover traces, to obliterate evidence, to expunge, to blot out, to suppress,"
配套,pei4 tao4,"to form a complete set, coherent,"
逝世,shi4 shi4,"to pass away, to die,"
威風,wei1 feng1,"might, awe-inspiring authority, impressive,"
壓榨,ya1 zha4,"to press, to squeeze, to extract juice, oil etc by squeezing,"
英明,ying1 ming2,"wise, brilliant,"
整頓,zheng3 dun4,"to tidy up, to reorganize, to consolidate, to rectify,"
總和,zong3 he2,"sum,"
本錢,ben3 qian2,"capital,"
功效,gong1 xiao4,"efficacy,"
壟斷,long3 duan4,"to enjoy market dominance, to monopolize,"
申報,shen1 bao4,"to report (to the authorities), to declare (to customs),"
狹隘,xia2 ai4,"narrow, tight, narrow minded, lacking in experience,"
隱患,yin3 huan4,"a danger concealed within sth, hidden damage, misfortune not visible from the surface,"
真摯,zhen1 zhi4,"sincere, sincerity,"
參謀,can1 mou2,"staff officer, to give advice,"
岔,cha4,"fork in road, bifurcation, branch in road, river, mountain range etc, to branch off, to turn off, to diverge, to stray (from the path), to change the subject, to interrupt, to stagger (times),"
柴油,chai2 you2,"diesel fuel,"
吃力,chi1 li4,"to entail strenuous effort, to toil at a task, strenuous, laborious, strain,"
充沛,chong1 pei4,"abundant, plentiful, vigorous,"
動盪,dong4 dang4,"unrest (social or political), turmoil, upheaval, commotion,"
高考,gao1 kao3,"college entrance exam (abbr. for 普通高等學校招生全國統一考試|普通高等学校招生全国统一考试), entrance exam for senior government service posts (Taiwan),"
勾結,gou1 jie2,"to collude with, to collaborate with, to gang up with,"
會晤,hui4 wu4,"to meet, meeting, conference,"
接連,jie1 lian2,"on end, in a row, in succession,"
結算,jie2 suan4,"to settle a bill, to close an account,"
品行,pin3 xing2,"behavior, moral conduct,"
惹禍,re3 huo4,"stirring up trouble, to invite disaster,"
攝氏度,She4 shi4 du4,"degrees centigrade,"
無償,wu2 chang2,"free, no charge, at no cost,"
媳婦,xi2 fu4,"daughter-in-law, wife (of a younger man), young married woman, young woman,"
新陳代謝,xin1 chen2 dai4 xie4,"metabolism (biology), the new replaces the old (idiom),"
虛榮,xu1 rong2,"vanity,"
亞軍,ya4 jun1,"second place (in a sports contest), runner-up,"
治理,zhi4 li3,"to govern, to administer, to manage, to control, governance,"
滯留,zhi4 liu2,"to detain, retention,"
主辦,zhu3 ban4,"to organize, to host (a conference or sports event),"
主權,zhu3 quan2,"sovereignty,"
暢通,chang4 tong1,"unimpeded, free-flowing, straight path, unclogged, move without obstruction,"
堆積,dui1 ji1,"to pile up, to heap, accumulation,"
海拔,hai3 ba2,"height above sea level, elevation,"
堅韌,jian1 ren4,"tough and durable, tenacious,"
枯竭,ku1 jie2,"used up, dried up, exhausted (of resources),"
眯,mi2,"to narrow one's eyes, to squint,"
民用,min2 yong4,"(for) civilian use,"
生疏,sheng1 shu1,"unfamiliar, strange, out of practice, not accustomed,"
盛行,sheng4 xing2,"to be in vogue, to be prevalent,"
斯文,si1 wen2,"refined, educate, cultured, intellectual, polite, gentle,"
懸掛,xuan2 gua4,"to suspend, to hang, suspension (cable car),"
別緻,bie2 zhi4,"variant of 別緻|别致[bié zhì],"
創業,chuang4 ye4,"to begin an undertaking, to start a major task, to initiate, to venture, venture, entrepreneurship,"
攻克,gong1 ke4,"to capture, to take, to overcome, to solve,"
狠心,hen3 xin1,"callous, heartless,"
覺悟,jue2 wu4,"consciousness, awareness, Buddhist enlightenment (Sanskrit: cittotpāda),"
開拓,kai1 tuo4,"to break new ground (for agriculture), to open up (a new seam), to develop (border regions), fig. to open up (new horizons),"
空隙,kong4 xi4,"crack, gap between two objects, gap in time between two events,"
派別,pai4 bie2,"denomination, group, school, faction, school of thought,"
傷腦筋,shang1 nao3 jin1,"knotty, troublesome, bothersome,"
為期,wei2 qi1,"(to be done) by (a certain date), lasting (a certain time),"
意向,yi4 xiang4,"intention, purpose, intent, inclination, disposition,"
自發,zi4 fa1,"spontaneous,"
崇敬,chong2 jing4,"to revere, high esteem,"
處分,chu3 fen4,"to discipline sb, to punish, disciplinary action, to deal with (a matter), CL:個|个[gè],"
端正,duan1 zheng4,"upright, regular, proper, correct,"
對照,dui4 zhao4,"to contrast, to compare, to place side by side for comparison (as parallel texts), to check,"
港灣,gang3 wan1,"natural harbor, bay serving as harbor,"
和氣,he2 qi5,"friendly, polite, amiable,"
媒介,mei2 jie4,"media, medium,"
文獻,wen2 xian4,"document,"
霸道,ba4 dao4,"the Way of the Hegemon, abbr. of 霸王之道, despotic rule, rule by might, evil as opposed to the Way of the King 王道, overbearing, tyranny, (of liquor, medicine etc) strong, potent,"
點綴,dian3 zhui4,"to decorate, to adorn, sprinkled, studded, only for show,"
歌頌,ge1 song4,"to sing the praises of, to extol, to eulogize,"
科目,ke1 mu4,"subject,"
聳,song3,"to excite, to raise up, to shrug, high, lofty, towering,"
一絲不苟,yi1 si1 bu4 gou3,"not one thread loose (idiom); strictly according to the rules, meticulous, not one hair out of place,"
雜交,za2 jiao1,"a hybrid,"
讚嘆,zan4 tan4,"to sigh or gasp in admiration, high praise,"
暫且,zan4 qie3,"for now, for the time being, temporarily,"
專科,zhuan1 ke1,"specialized subject, branch (of medicine), specialized training school,"
遲緩,chi2 huan3,"slow, sluggish,"
浸泡,jin4 pao4,"to steep, to soak, to immerse,"
欄目,lan2 mu4,"regular column or segment (in a publication or broadcast program), program (TV or radio),"
利率,li4 lu:4,"interest rates,"
威信,Wei1 xin4,"prestige, reputation, trust, credit with the people,"
慰問,wei4 wen4,"to express sympathy, greetings, consolation etc,"
眼色,yan3 se4,"a wink, to signal with one's eyes,"
一目了然,yi1 mu4 liao3 ran2,"obvious at a glance (idiom),"
有條不紊,you3 tiao2 bu4 wen3,"regular and thorough (idiom); methodically arranged,"
燈籠,deng1 long2,"lantern,"
時事,shi2 shi4,"current trends, the present situation, how things are going,"
世代,shi4 dai4,"generation, an era, accumulation of years, passing on from generation to generation,"
停泊,ting2 bo2,"to anchor, anchorage, mooring (of a ship),"
新穎,xin1 ying3,"lit. new bud, fig. new and original,"
興高采烈,xing4 gao1 cai3 lie4,"happy and excited (idiom); in high spirits, in great delight,"
制訂,zhi4 ding4,"to work out, to formulate,"
自力更生,zi4 li4 geng1 sheng1,"regeneration through one's own effort (idiom), self-reliance,"
叢,cong2,"cluster, collection, collection of books, thicket,"
淡水,Dan4 shui3,"potable water (water with low salt content), fresh water,"
槓桿,gang4 gan3,"lever, pry bar, crowbar, financial leverage,"
家喻戶曉,jia1 yu4 hu4 xiao3,"understood by everyone (idiom); well known, a household name,"
開闢,kai1 pi4,"to open up, to set up, to establish,"
靠攏,kao4 long3,"to draw close to,"
立足,li4 zu2,"to stand, to have a footing, to be established, to base oneself on,"
踏實,ta1 shi5,"practical, down-to-earth, realistic, firmly based, steadfast, to have peace of mind, free from anxiety,"
依次,yi1 ci4,"in order, in succession,"
周折,zhou1 zhe2,"complication, twists and turns, problem, setback,"
冰雹,bing1 bao2,"hail, hailstone, CL:場|场,粒[lì],"
進而,jin4 er2,"and then (what follows next),"
框架,kuang4 jia4,"frame, framework, fig. pattern, outline, organizing plan,"
平坦,ping2 tan3,"level, even, smooth, flat,"
請示,qing3 shi4,"to ask for instructions,"
確立,que4 li4,"to establish, to institute,"
盛情,sheng4 qing2,"great kindness, magnificent hospitality,"
肆無忌憚,si4 wu2 ji4 dan4,"absolutely unrestrained, unbridled, without the slightest scruple,"
便於,bian4 yu2,"easy to, convenient for,"
草案,cao3 an4,"draft (legislation, proposal etc),"
赤字,chi4 zi4,"(financial) deficit, red letter,"
疙瘩,ge1 da5,"swelling or lump on skin, pimple, knot, preoccupation, problem,"
工藝品,gong1 yi4 pin3,"handicraft article, handiwork, CL:個|个[gè],"
精簡,jing1 jian3,"to simplify, to reduce,"
埋沒,mai2 mo4,"to engulf, to bury, to overlook, to stifle, to neglect, to fall into oblivion,"
偏差,pian1 cha1,"bias, deviation,"
品德,pin3 de2,"moral character,"
散文,san3 wen2,"prose, essay,"
時而,shi2 er2,"occasionally, from time to time,"
隨即,sui2 ji2,"immediately, presently, following which,"
倘若,tang3 ruo4,"provided that, supposing that, if,"
飆升,biao1 sheng1,"to rise rapidly, to soar,"
繁華,fan2 hua2,"flourishing, bustling,"
舉足輕重,ju3 zu2 qing1 zhong4,"a foot's move sways the balance (idiom); to hold the balance of power, to play the decisive role,"
考核,kao3 he2,"to examine, to check up on, to assess, to review, appraisal, review, evaluation,"
母語,mu3 yu3,"native language, mother tongue, (linguistics) parent language,"
通俗,tong1 su2,"common, everyday, average,"
以至,yi3 zhi4,"down to, up to, to such an extent as to ... (also written 以至於|以至于),"
裝卸,zhuang1 xie4,"to load or unload, to transfer, to assemble and disassemble,"
變故,bian4 gu4,"an unforeseen event, accident, misfortune,"
不相上下,bu4 xiang1 shang4 xia4,"equally matched, about the same,"
大體,da4 ti3,"in general, more or less, in rough terms, basically, on the whole,"
發揚,fa1 yang2,"to develop, to make full use of,"
反問,fan3 wen4,"to ask (a question) in reply, to answer a question with a question, rhetorical question,"
姑且,gu1 qie3,"temporarily, the time being, for the moment, provisional, tentatively,"
灌溉,guan4 gai4,"to irrigate,"
論證,lun4 zheng4,"to prove a point, to expound on, to demonstrate or prove (through argument), proof,"
天文,tian1 wen2,"astronomy,"
調和,tiao2 he2,"harmonious, to mediate, to reconcile, to compromise, mediation, to mix, to blend, blended, to season, seasoning, to placate,"
誤差,wu4 cha1,"difference, error, inaccuracy,"
一律,yi1 lu:4,"same, uniformly, all, without exception,"
隱約,yin3 yue1,"vague, faint, indistinct,"
油膩,you2 ni4,"grease, greasy food, oily, rich (of food), fatty, greasy and dirty, a slippery character,"
摘要,zhai1 yao4,"summary, abstract,"
爭氣,zheng1 qi4,"to work hard for sth, to resolve on improvement, determined not to fall short,"
注釋,zhu4 shi4,"marginal notes, annotation, to annotate, to add comments to text,"
播種,bo1 zhong3,"to sow seeds, sowing, seed,"
寒暄,han2 xuan1,"exchanging conventional greetings, to talk about the weather,"
加劇,jia1 ju4,"to intensify, to sharpen, to accelerate, to aggravate, to exacerbate, to embitter,"
伶俐,ling2 li4,"clever, witty, intelligent,"
萌芽,meng2 ya2,"sprout, germ of a plant,"
千方百計,qian1 fang1 bai3 ji4,"lit. thousand ways, a hundred plans (idiom); by every possible means,"
書法,shu1 fa3,"calligraphy, handwriting, penmanship,"
問世,wen4 shi4,"to be published, to come out,"
追悼,zhui1 dao4,"to mourn, to pay last respects, mourning, memorial (service etc),"
鑽研,zuan1 yan2,"to study meticulously, to delve into,"
巴結,ba1 jie5,"to fawn on, to curry favor with, to make up to,"
不屑一顧,bu4 xie4 yi1 gu4,"to disdain as beneath contempt,"
陳列,chen2 lie4,"to display, to exhibit,"
赤道,chi4 dao4,"equator (of the earth or astronomical body),"
無窮無盡,wu2 qiong2 wu2 jin4,"vast and limitless (idiom); endless span of time, no vestige of a beginning, no prospect of an end,"
鑲嵌,xiang1 qian4,"to inlay, to embed, to set (e.g. a jewel in a ring), tiling, tesselation,"
心疼,xin1 teng2,"to love dearly, the pain of love,"
胸懷,xiong1 huai2,"one's bosom (the seat of emotions), breast, broad-minded and open, to think about, to cherish,"
熒屏,ying2 ping2,"fluorescent screen, TV screen,"
拄,zhu3,"to lean on, to prop on,"
操勞,cao1 lao2,"to work hard, to look after,"
督促,du1 cu4,"to supervise and urge completion of a task, to urge on,"
遏制,e4 zhi4,"to check, to contain, to hold back, to keep within limits, to constrain, to restrain,"
蓋章,gai4 zhang1,"to affix a seal (to sth),"
湖泊,hu2 po1,"lake,"
開水,kai1 shui3,"boiled water, boiling water,"
刊物,kan1 wu4,"publication,"
橢圓,tuo3 yuan2,"oval, ellipse, elliptic,"
心得,xin1 de2,"knowledge gained, CL:個|个[gè],"
著重,zhuo2 zhong4,"put emphasis on, to stress, to emphasize,"
不言而喻,bu4 yan2 er2 yu4,"it goes without saying, it is self-evident,"
